PROVINCIA,COMUNE,ID_AGISCO,DENOMINAZIONE,INDIRIZZO,NOTE,TIPOLOGIA SITO/ATTIVITA',LONGITUDINE,LATITUDINE,LOCATION,PRECISIONE_LOCATION
VARESE,BIANDRONNO,VA014.0002,Stabilimento SWM,"VIA NINO BIXIO, 8",,aree industriali in attività,8.70557956,45.79872859,POINT (8.70557956 45.79872859),alta
MONZA E DELLA BRIANZA,MONZA,MB033.0031,EX CASERMA IV NOVEMBRE,VIA MONTEVECCHIA,(*),altri siti non meglio specificati,9.24970912,45.59347655,POINT (9.24970912 45.59347655),alta
MILANO,MILANO,MI146.0667,PUNTO VENDITA SHELL N. 49.491,"VIALE ALCIDE DE GASPERI, 2/1",,impianti di stoccaggio o adduzione carburanti,9.14007438,45.48973518,POINT (9.14007438 45.48973518),alta
VARESE,CASSANO MAGNAGO,VA040.0013,"AREA EX PREVIATI VIA BONICALZA, 132","VIA MARIO ALBINO BONICALZA, 132",(*),altri siti non meglio specificati,8.8441712,45.65884899,POINT (8.8441712 45.65884899),alta
LECCO,COLICO,LC023.0009,A.T.L. SPA (IVECO),"VIA AL CONFINE, 19/21",,rilasci accidentali o dolosi di sostanze,9.39413457,46.14006101,POINT (9.39413457 46.14006101),alta
MILANO,MILANO,MI146.1642,Area Via Quarto Cagnino,"VIA QUARTO CAGNINO, 39",(*),aree industriali dismesse,9.11569985,45.47325352,POINT (9.11569985 45.47325352),alta
MILANO,CORSICO,MI093.0001,PVF 0469 ESSO ITALIANA Srl,"VIALE DELLA RESISTENZA, 50",,impianti di stoccaggio o adduzione carburanti,9.10765785,45.42751199,POINT (9.10765785 45.42751199),alta
MANTOVA,MANTOVA,MN030.0128,EX IMPIANTO DI LAVAGGIO AUTOCISTERNE,"STRADA GHISIOLO, 2",,impianti di stoccaggio o adduzione carburanti,10.83190675,45.1754223,POINT (10.83190675 45.1754223),alta
BRESCIA,MONTICHIARI,BS113.0027,"SCARICHI IDRICI NEL TERRENO, DITTA NORMALIEN SPA",VIA GRAZIA DELEDDA,,aree industriali in attività,10.32883784,45.45083957,POINT (10.32883784 45.45083957),alta
MILANO,MILANO,MI146.4280,AD SOLUZIONI SRL,"VIA ANNA NEERA, 10",,aree industriali dismesse,9.17505329,45.43297832,POINT (9.17505329 45.43297832),alta
MANTOVA,GUIDIZZOLO,MN028.0005,"SINISTRO CON CONSEGUENTE SVERSAMENTO DI BENZINA E GASOLIO, SS 236 KM 26+250",STRADA STATALE 236 GOITESE,(*),rilasci accidentali o dolosi di sostanze,10.5706747,45.31021799,POINT (10.5706747 45.31021799),bassa
LECCO,LECCO,LC042.0005,PUNTO VENDITA TAMOIL (EX AGIP) 1873,"CORSO BERGAMO, 157",,impianti di stoccaggio o adduzione carburanti,9.41972379,45.81688436,POINT (9.41972379 45.81688436),alta
BERGAMO,ALMENNO SAN SALVATORE,BG007.0002,Area proprietà privata,"VIA DEI ROCCOLI, 12",,serbatoi carburante per riscaldamento,9.58130553,45.75410298,POINT (9.58130553 45.75410298),alta
LODI,PIEVE FISSIRAGA,LO045.0005,Itelyum Regeneration (ex VISCOLUBE),"VIA TAVERNELLE, 19",,aree industriali in attività,9.45696628,45.26942747,POINT (9.45696628 45.26942747),alta
PAVIA,VOGHERA,PV182.0016,AREA DITTA MATTI S.P.A.,"STRADA DI ORIOLO, 85",(*),operazioni di recupero rifiuti,9.01910549,45.02488078,POINT (9.01910549 45.02488078),alta
MILANO,MILANO,MI146.3341,CENTRO SPORTIVO COLOMBO,VIA CARDELLINO ANG.DELLA RONDINE,,serbatoi carburante per riscaldamento,9.1238035,45.4484308,POINT (9.1238035 45.4484308),alta
MILANO,MILANO,MI146.0353,AREA EX SQUEO AUTODEMOLIZIONI,VIALE PUGLIE 26/28,,smaltimenti non autorizzati - abbandono rifiuti,9.22383041,45.4495714,POINT (9.22383041 45.4495714),alta
MILANO,MILANO,MI146.0113,AREA ALER - ZAMA SALOMONE,VIE ZAMA/SALOMONE,,altri siti non meglio specificati,9.23777468,45.45377266,POINT (9.23777468 45.45377266),alta
LODI,BORGHETTO LODIGIANO,LO004.0003,EX COOPERATIVA EDILIZIA EUROPEA 2000,"VIA GIUSEPPE GARIBALDI, 59",,altri siti non meglio specificati,9.49806813,45.21256033,POINT (9.49806813 45.21256033),alta
BERGAMO,URGNANO,BG222.0003,"Azienda agricola, demolizione edificio",VIA DEI CURTI,,aree industriali dismesse,9.6940477,45.60289628,POINT (9.6940477 45.60289628),alta
MILANO,PESSANO CON BORNAGO,MI172.0004,Area Cna Novellana,LOCALITA' C.NA NOVELLANA,(*),discariche abusive o incontrollate,9.38538649,45.54792285,POINT (9.38538649 45.54792285),bassa
VARESE,MORNAGO,VA106.0001,"ex ""Galstaff Multiresine"" ora ""Hickson Coasting S.r.l.""","VIA STAZIONE, 90",,aree industriali in attività,8.73378074,45.73131769,POINT (8.73378074 45.73131769),alta
COMO,CASTELMARTE,CO058.0003,GAL.FOR. - EX AREA INDUSTRIALE,"VIA TAGLIAMENTO, 14",,aree industriali dismesse,9.24341414,45.8360783,POINT (9.24341414 45.8360783),bassa
BERGAMO,CASAZZA,BG058.0001,PV Agip - ENI S.p.A. P.V. 1522,"VIA NAZIONALE, 42",(*),impianti di stoccaggio o adduzione carburanti,9.90865072,45.74633376,POINT (9.90865072 45.74633376),alta
MILANO,PREGNANA MILANESE,MI179.0002,DEPOSITO KUWAIT,"VIALE LOMBARDIA, 38",(*),impianti di stoccaggio o adduzione carburanti,9.01433788,45.5182713,POINT (9.01433788 45.5182713),alta
MILANO,MILANO,MI146.1559,Area ex ELECTROCLEANING S.r.l.,"VIA GIOVANNI MELI, 30",,aree industriali dismesse,9.23970957,45.50521957,POINT (9.23970957 45.50521957),alta
MILANO,TREZZANO SUL NAVIGLIO,MI220.0002,MANULI AUTOMOTIVE SPA ORA MAFLOW SPA,"VIA GIOVANNI BOCCACCIO, 1",,aree industriali in attività,9.05725774,45.41841466,POINT (9.05725774 45.41841466),alta
MILANO,MILANO,MI146.2754,AREA DI VIA FREIKOFEL,"VIA FREIKOFEL, 26",,aree industriali dismesse,9.24582538,45.43231716,POINT (9.24582538 45.43231716),alta
MILANO,ROZZANO,MI189.0036,ATTIVITA' COMMERCIALE,"VIA EUGENIO CURIEL, 25",,impianti di stoccaggio o adduzione carburanti,9.17311589,45.39688008,POINT (9.17311589 45.39688008),alta
MILANO,MILANO,MI097.0010,OLEODOTTO ENI FERRERA-RHO,S.P.114 ALTEZZA DEVIAZIONE CASCINA SCARIONA,,rilasci accidentali o dolosi di sostanze,9.15118787,45.51565367,POINT (9.15118787 45.51565367),alta
MILANO,MILANO,MI146.4332,PIO ISTITUTO SORDI,"VIA JESI, 2",,aree industriali in attività,9.23194644,45.50074081,POINT (9.23194644 45.50074081),alta
COMO,,CO215.0001,"P.V. TOTALERG, ex CO178",S.S.342 KM 73+350,,impianti di stoccaggio o adduzione carburanti,,,,nd
MILANO,MILANO,MI146.4132,"PLESSO SCOLASTICO COMUNALE, rimozione due cisterne interrate asservite all'impianto riscaldamento","VIA PIERO STROZZI, 11",,altri siti non meglio specificati,9.14333557,45.45999649,POINT (9.14333557 45.45999649),alta
VARESE,VARESE,VA133.0030,MV Agusta Motors spa,"VIA GIOVANNI MACCHI, 144",,aree industriali in attività,8.77994544,45.80259427,POINT (8.77994544 45.80259427),alta
MONZA E DELLA BRIANZA,VILLASANTA,MI239.0003,LOMBARDA PETROLI S.P.A.,"VIA RAFFAELLO SANZIO, 4",,aree industriali in attività,9.30401321,45.60152561,POINT (9.30401321 45.60152561),alta
MILANO,SAN GIORGIO SU LEGNANO,MI194.0004,EX CHICO SNC e CROMATURA MODERNA SRL,VIA EISTEIN SNC,,aree industriali dismesse,8.9096922,45.57241436,POINT (8.9096922 45.57241436),bassa
MILANO,RHO,MI182.0013,CROMATURA RHODENSE,"VIA DELLA SENNA, 11",,aree industriali in attività,9.04399564,45.51878324,POINT (9.04399564 45.51878324),alta
MILANO,MILANO,MI146.4231,AREA VIA CAVALCABO',"VIA PIETRO CAVALCABO', 4",,aree industriali dismesse,9.15124377,45.46168544,POINT (9.15124377 45.46168544),alta
VARESE,SARONNO,VA119.0020,AREA EX CANTONI,"VIA DON SILVIO MARZORATI, 22",,aree industriali dismesse,9.04469918,45.62916919,POINT (9.04469918 45.62916919),alta
MILANO,CESANO BOSCONE,MI074.0011,AREA VIA MONEGHERIO,"VIA MARIA MONEGHERIO, 3/5",,aree industriali dismesse,9.09266673,45.44788368,POINT (9.09266673 45.44788368),alta
LODI,LODI,LO031.0006,P.V. TotalErg (ex AGIP N. 2168),VIALE SANT' ANGELO,,impianti di stoccaggio o adduzione carburanti,9.50176833,45.30575794,POINT (9.50176833 45.30575794),alta
MILANO,PESCHIERA BORROMEO,MI171.0007,RAM 1 - AEREOPORTO LINATE,LOCALITA' AEREOPORTO DI LINATE,,impianti di stoccaggio o adduzione carburanti,9.27207334,45.44535786,POINT (9.27207334 45.44535786),alta
CREMONA,SERGNANO,CR094.0005,P.V. TAMOIL 6086,"VIA SANT' ANTONIO, 5",,impianti di stoccaggio o adduzione carburanti,9.70229992,45.42523433,POINT (9.70229992 45.42523433),alta
MILANO,MILANO,MI146.2700,EX PV Q8 N. 1156,"VIA LORENTEGGIO, 243",,aree industriali dismesse,9.12146072,45.44517163,POINT (9.12146072 45.44517163),alta
BRESCIA,DELLO,BS066.0002,Ex tintoria ECO-NEPROMA,"VIA SAN ZENONE, 191",,aree industriali dismesse,10.09693882,45.42672507,POINT (10.09693882 45.42672507),alta
PAVIA,CASTEGGIO,PV037.0002,EX PV SHELL,"VIA EMILIA, 107",,impianti di stoccaggio o adduzione carburanti,9.13214983,45.01723305,POINT (9.13214983 45.01723305),alta
MONZA E DELLA BRIANZA,BOVISIO MASCIAGO,MI030.0011,INDUSTRIA CHIMICA BOVISIO (ICSAM) - EX AREA INDUSTRIALE,"VIA TOLMINO, 56",,aree industriali dismesse,9.1587292,45.61210324,POINT (9.1587292 45.61210324),alta
MILANO,MILANO,MI146.3593,AREA RCS Media Group SpA,"VIA ANGELO RIZZOLI, 2-4-6-8",(*),altri siti non meglio specificati,9.24929496,45.50383172,POINT (9.24929496 45.50383172),alta
MILANO,MILANO,MI146.3824,"SHELL, PV N. 49.088","VIALE CASSALA, 4/A",,impianti di stoccaggio o adduzione carburanti,9.15998583,45.44593814,POINT (9.15998583 45.44593814),alta
VARESE,TRAVEDONA - MONATE,VA128.0001,EX DISCARICA COMUNALE,LOCALITA' BOSCO GROSSO,,discariche abusive o incontrollate,8.67920101,45.80177754,POINT (8.67920101 45.80177754),alta
MILANO,BOFFALORA SOPRA TICINO,MI026.0021,RDM _MAGENTA,S.P.,,aree industriali dismesse,8.83265169,45.46311237,POINT (8.83265169 45.46311237),bassa
BRESCIA,GIANICO,BS079.0001,FORGIATURA MODERNA ARESE - EX ACCIAIERIE E FERRIERE SEBINO S.p.A.,"VIA CAROBE, 9",,aree industriali in attività,10.17544224,45.86605338,POINT (10.17544224 45.86605338),alta
MILANO,BUCCINASCO,MI036.0017,VIA GUIDO ROSSA-VIA ROMA,VIA GUIDO ROSSA,,smaltimenti non autorizzati - abbandono rifiuti,9.12846638,45.41562245,POINT (9.12846638 45.41562245),alta
MONZA E DELLA BRIANZA,BRUGHERIO,MI034.0020,GGG SARDI & C. EX AREA INDUSTRIALE,VIE SAN GIUSEPPE-GALBIATI,(*),aree industriali dismesse,9.2951018,45.55083395,POINT (9.2951018 45.55083395),alta
MILANO,MILANO,MI146.4251,EX TECNINOX,"VIA BULLONA, 5",,aree industriali dismesse,9.16203738,45.48577548,POINT (9.16203738 45.48577548),alta
MILANO,MILANO,MI146.0930,FONDAZIONE E.A FIERA INTERNAZIONALE DI MILANO AREA CERNIERA,"LARGO DOMODOSSOLA, 1",,aree industriali dismesse,9.15979996,45.48002938,POINT (9.15979996 45.48002938),alta
PAVIA,PAVIA,PV110.0008,PV AGIP 2569,"VIALE CREMONA, 69",,impianti di stoccaggio o adduzione carburanti,9.19069595,45.17915206,POINT (9.19069595 45.17915206),alta
PAVIA,SANNAZZARO DE BURGONDI,PV138.0001,RAFFINERIA DI SANNAZZARO ENI S.P.A.,"VIA ENRICO MATTEI, 46",,aree industriali in attività,8.89798961,45.10227839,POINT (8.89798961 45.10227839),alta
COMO,VERTEMATE CON MINOPRIO,CO242.0012,ABET LAMINATI SPA,STRADA PROVINCIALE PER BULGAROGRASSO 3,,aree industriali dismesse,9.06312744,45.72487246,POINT (9.06312744 45.72487246),alta
BRESCIA,PAVONE DEL MELLA,BS137.0004,AREA EX DISCOTECA,"VIA PER PRALBOINO, 20",,serbatoi carburante per riscaldamento,10.21122755,45.2914056,POINT (10.21122755 45.2914056),alta
MONZA E DELLA BRIANZA,MONZA,MI149.0064,EX AREA INDUSTRIALE,VIE BORGAZZI-CAMPANIA,,aree industriali dismesse,9.2593038,45.56508504,POINT (9.2593038 45.56508504),alta
BERGAMO,FILAGO,BG098.0003,DSM COMPOSITE RESINS ITALIA SRL,"VIA RODI, 5",,aree industriali in attività,9.53958896,45.63938608,POINT (9.53958896 45.63938608),alta
MILANO,MILANO,MI146.4042,AREA VIA PIRANESI,"VIA GIOVANNI BATTISTA PIRANESI, 18",,aree industriali dismesse,9.22783891,45.46070869,POINT (9.22783891 45.46070869),alta
MILANO,SETTALA,MI210.0003,HENKEL,"VIA DON GIOVANNI MINZONI, 1",,aree industriali in attività,9.39456574,45.42585203,POINT (9.39456574 45.42585203),alta
MILANO,MILANO,MI146.4258,AREA DI VIA BOVIO,"VIA GIOVANNI BOVIO, 10/12/14/16",,aree industriali dismesse,9.18429267,45.50290152,POINT (9.18429267 45.50290152),alta
MILANO,MILANO,MI146.4319,SCUOLA COMUNALE oggetto di riqualificazione edilizia,VIA BROCCHI 5,,altri siti non meglio specificati,9.12101918,45.49271634,POINT (9.12101918 45.49271634),alta
SONDRIO,LANZADA,SO036.0002,Area Proprietà privata,VIA SAN GIOVANNI,,altri siti non meglio specificati,9.86851019,46.26916219,POINT (9.86851019 46.26916219),alta
MILANO,SEGRATE,MI205.0004,EX 3B ITALIA IMMOBILIARE ARDUINA ITALIA,"VIA REDECESIO, 18",,smaltimenti non autorizzati - abbandono rifiuti,9.26981636,45.48506031,POINT (9.26981636 45.48506031),alta
BERGAMO,SCANZOROSCIATE,BG194.0003,POLYNT SPA,"VIA ENRICO FERMI, 51",,aree industriali in attività,9.73856988,45.70716201,POINT (9.73856988 45.70716201),alta
MILANO,PAULLO,MI169.0006,P.V. AGIP 51919,VIA MILANO,(*),impianti di stoccaggio o adduzione carburanti,9.40061467,45.4160419,POINT (9.40061467 45.4160419),alta
MANTOVA,CASTIGLIONE DELLE STIVIERE,MN017.0003,Cava del PIRATA,LOCALITA' CASCINA FONTANELLA,(*),smaltimenti non autorizzati - abbandono rifiuti,10.4656673,45.3964913,POINT (10.4656673 45.3964913),alta
BERGAMO,BERGAMO,BG024.0128,EX OSPEDALI RIUNITI - AREA UMI3 BONIFICA,LARGO GIOVANNI BAROZZI,,altri siti non meglio specificati,9.65367386,45.69921943,POINT (9.65367386 45.69921943),alta
VARESE,BUSTO ARSIZIO,VA026.0126,SOCIETÀ ATT S.R.L,VIA MONTI ANGOLO VIA BAZZECCA,,aree industriali dismesse,8.85207199,45.60664654,POINT (8.85207199 45.60664654),alta
MILANO,SESTO SAN GIOVANNI,MI209.0086,EX PV Q8 1126,"VIA PADRE ERNESTO RAVASI, 19",,impianti di stoccaggio o adduzione carburanti,9.24028935,45.53520594,POINT (9.24028935 45.53520594),alta
MANTOVA,ASOLA,MN002.0017,EX FLUCOSIT - ACQUE SOTTERRANEE,S.P.CASTELNUOVO 68,,altri siti non meglio specificati,10.4301371,45.22176028,POINT (10.4301371 45.22176028),bassa
BRESCIA,PONTEVICO,BS149.0009,FAI-FTC SPA,VIA ENRICO MATTEI,,aree industriali dismesse,10.12306344,45.26621576,POINT (10.12306344 45.26621576),alta
MILANO,SESTO SAN GIOVANNI,MI209.0163,LAGHETTO PARCO CARLO MARX,VIA CARLO MARX,,altri siti non meglio specificati,9.24749644,45.5254154,POINT (9.24749644 45.5254154),alta
VARESE,CASTELLANZA,VA042.0025,RESCOL ora CHIMICA POMPONESCO,"VIA DEL SEMPIONE, 13",,aree industriali dismesse,8.88163056,45.61580483,POINT (8.88163056 45.61580483),alta
MILANO,LISCATE,MI122.0009,AIR LIQUIDE ITALIA SERVICE,"VIA DEL LAGO, 8/10",,aree industriali dismesse,9.39637405,45.47900344,POINT (9.39637405 45.47900344),alta
BRESCIA,BRESCIA,BS029.0022,Area Ex-Pietra s.p.a. - FINSIBI S.p.A. (SIN Brescia-Caffaro per Falda),"VIA ORZINUOVI, 8",,aree industriali dismesse,10.19500336,45.52751441,POINT (10.19500336 45.52751441),alta
MILANO,ARESE,MI009.0032,Area industriale Officine Saspe S.r.l.,"VIA SENATO, 10",,aree industriali dismesse,9.08319369,45.5436525,POINT (9.08319369 45.5436525),alta
MILANO,VIMODRONE,MI242.0029,RIQUALIFICA EDILIZIA IMMOBILIARE ROMA,"STRADA STATALE 11 PADANA SUPERIORE, 133",,altri siti non meglio specificati,9.28720479,45.51454179,POINT (9.28720479 45.51454179),bassa
MILANO,LEGNANO,MI118.0040,AREA EX STASER,"VIA PISA, 21",,aree industriali dismesse,8.89989189,45.5871857,POINT (8.89989189 45.5871857),alta
LODI,MALEO,LO035.0001,EX DISCARICA R.S.U.,LOCALITA' CASCINA SESSA,,discariche autorizzate,9.75180968,45.17481891,POINT (9.75180968 45.17481891),alta
MANTOVA,OSTIGLIA,MN038.0015,AREA EXPO DI PIAZZA MAZZINI,PIAZZA GIUSEPPE MAZZINI,,aree industriali dismesse,11.133076,45.06818624,POINT (11.133076 45.06818624),alta
BERGAMO,GAZZANIGA,BG111.0001,AREA EX MASSERINI RIPORTI INDUSTRIALI - AREA VIA CRISPI,VIA FRANCESCO CRISPI,,aree industriali dismesse,9.83027584,45.79495885,POINT (9.83027584 45.79495885),alta
BERGAMO,SERIATE,BG198.0016,EX FRATTINI,"VIA COMONTE, 15",(*),aree industriali in attività,9.73852111,45.68560033,POINT (9.73852111 45.68560033),alta
CREMONA,CREMA,CR035.0002,BOSCH VHIT S.P.A.,"VIA FRANCESCO CAVALLI, 53/A",,aree industriali dismesse,9.68339821,45.36732294,POINT (9.68339821 45.36732294),alta
MILANO,ROZZANO,MI189.0007,P.V. SHELL ITALIA SPA,"VIA EUGENIO CURIEL, 25",,impianti di stoccaggio o adduzione carburanti,9.17311589,45.39688008,POINT (9.17311589 45.39688008),alta
COMO,CUCCIAGO,CO084.0004,EREDI BIANCHI (PARTE EX GUGLIELMETTI),"VIA PER CANTU', 29/A",,aree industriali dismesse,9.11049719,45.74222525,POINT (9.11049719 45.74222525),alta
MONZA E DELLA BRIANZA,VAREDO,MI231.0011,GLOBAL CIRCUIT,"VIA VITTORIO EMANUELE ORLANDO, 40",,aree industriali dismesse,9.16312593,45.59534005,POINT (9.16312593 45.59534005),alta
COMO,GUANZATE,CO114.0003,SINISTRO DEL 12/05/03 S.P. 25 RIBALTAMENTO AUTOCISTERNA,VIA PATRIOTI,,rilasci accidentali o dolosi di sostanze,9.00823909,45.72688506,POINT (9.00823909 45.72688506),alta
MILANO,ASSAGO,MI011.0010,AUTODEMOLITORE,"VIA ALESSANDRO VOLTA, 9",,smaltimenti non autorizzati - abbandono rifiuti,9.12419962,45.41179107,POINT (9.12419962 45.41179107),alta
MILANO,MILANO,MI146.0370,AREA CONDOMINIO - Serbatoio,"CORSO MAGENTA, 65",,rilasci accidentali o dolosi di sostanze,9.17127767,45.46570412,POINT (9.17127767 45.46570412),alta
BERGAMO,BERGAMO,BG024.0119,"GRUPEDIL SPA (AREE EX OTE, EX ZURCHER, EX NORIS&FIGLI)",VIE BIANZANA/SERASSI,,aree industriali dismesse,9.6888541,45.7062481,POINT (9.6888541 45.7062481),alta
MILANO,MILANO,MI146.4327,AREA VIA CIALDINI,"VIA ENRICO CIALDINI, 67",,aree industriali dismesse,9.1708068,45.51112537,POINT (9.1708068 45.51112537),alta
MILANO,CERRO AL LAMBRO,MI071.0001,CASCINA GAZZERA,LOCALITA' CASCINA GAZZERA,,smaltimenti non autorizzati - abbandono rifiuti,9.34704067,45.32178087,POINT (9.34704067 45.32178087),alta
MILANO,SOLARO,MI213.0011,AREA EX CROMOSYSTEM,"VIA DELLA FERROVIA, 3",,aree industriali dismesse,9.05499235,45.62174909,POINT (9.05499235 45.62174909),alta
MILANO,MILANO,MI146.3227,AREA DI VIA PASTORELLI,"VIA GIOVANNI PASTORELLI, 13",,aree industriali dismesse,9.16120013,45.4467846,POINT (9.16120013 45.4467846),alta
PAVIA,STRADELLA,PV153.0006,"P.V. IP 44018, Area di Servizio Stradella Sud",AUTOSTRADA A21 DIREZIONE PIACENZA,,impianti di stoccaggio o adduzione carburanti,9.3096862,45.07323109,POINT (9.3096862 45.07323109),bassa
MILANO,MILANO,MI146.1084,AREA EX FIERA Contractor TRE TORRI,"LARGO DOMODOSSOLA, 1A",,altri siti non meglio specificati,9.15979996,45.48002938,POINT (9.15979996 45.48002938),alta
BRESCIA,LUMEZZANE,BS096.0020,CIMITERO UNICO,VIA MASSIMO D' AZEGLIO,,smaltimenti non autorizzati - abbandono rifiuti,10.26896043,45.6486214,POINT (10.26896043 45.6486214),alta
MILANO,BELLINZAGO LOMBARDO,MI016.0002,Ditta NE.MA. Di Negri e Manzoni S.n.c.,"VIA PADANA SUPERIORE, 122",,aree industriali dismesse,9.45298367,45.54692244,POINT (9.45298367 45.54692244),alta
MILANO,MILANO,MI146.1280,AREA DEGRADATA VIA ZECCA VECCHIA,"VIA ZECCA VECCHIA, 2",,altri siti non meglio specificati,9.18459979,45.46286726,POINT (9.18459979 45.46286726),alta
MILANO,MILANO,MI146.4307,sversamento accidentale di gasolio,"VIA GIUSEPPE BOTTELLI, 11",,rilasci accidentali o dolosi di sostanze,9.20983815,45.50343436,POINT (9.20983815 45.50343436),alta
PAVIA,CARBONARA AL TICINO,PV030.0001,Inquinamento da gasolio del 7/9/2006 Cascina dei Frati,VIA CASCINA DEI FRATI,(*),impianti di stoccaggio o adduzione carburanti,9.08275595,45.16079901,POINT (9.08275595 45.16079901),bassa
MILANO,BUSTO GAROLFO,MI041.0031,EFFRAZIONE OLEODOTTO ENI,VIA PER FURATO,,rilasci accidentali o dolosi di sostanze,8.87703795,45.53620294,POINT (8.87703795 45.53620294),alta
MILANO,PERO,MI170.0027,PETRONAS LUBRIFICANTS ITALY,"VIA SEMPIONE, 191",,impianti di stoccaggio o adduzione carburanti,9.0812011,45.51337189,POINT (9.0812011 45.51337189),alta
MILANO,MILANO,MI146.4213,AREA VIA PIZZI,"VIA GIAN FRANCESCO PIZZI, 5",,aree industriali dismesse,9.20136955,45.43683533,POINT (9.20136955 45.43683533),alta
VARESE,LAVENA PONTE TRESA,VA086.0002,AREA EX SVIT,VIALE UNGHERIA,,altri siti non meglio specificati,8.85853706,45.96548211,POINT (8.85853706 45.96548211),alta
BERGAMO,CALCIO,BG044.0010,CEPAV DUE AV/AC MILANO-VERONA - LOTTO FUNZIONALE TREVIGLIO-BRESCIA,,,altri siti non meglio specificati,9.84531095,45.50224366,POINT (9.84531095 45.50224366),bassa
MONZA E DELLA BRIANZA,ALBIATE,MI006.0002,TERRITORIO COMUNALE (EX ATHENA),"VIALE LOMBARDIA, 26",,aree industriali in attività,9.25063897,45.65991692,POINT (9.25063897 45.65991692),alta
MILANO,BAREGGIO,MI012.0019,ENI S.P.A. AREA HUB NORD - OLEODOTTO SANNAZZARO-RHO,VIA GIOVANNI FALCONE,,rilasci accidentali o dolosi di sostanze,9.00039276,45.48731219,POINT (9.00039276 45.48731219),alta
MILANO,SESTO SAN GIOVANNI,MI209.0063,AREA PARCO DELLE TORRI,VIA CARLO MARX,,smaltimenti non autorizzati - abbandono rifiuti,9.24749644,45.5254154,POINT (9.24749644 45.5254154),alta
MILANO,PIOLTELLO,MI175.0036,TELECOM ITALIA,VIA ERODOTO,(*),,9.32383845,45.51221899,POINT (9.32383845 45.51221899),alta
MILANO,MILANO,MI146.2841,BNP PARIBAS REAL ESTATE - IMMOBILE,"VIA FEDERICO DE ROBERTO, 5",(*),serbatoi carburante per riscaldamento,9.13773052,45.51505678,POINT (9.13773052 45.51505678),alta
BRESCIA,SAN FELICE DEL BENACO,BS171.0001,ESSO ITALIANA SRL,"VIALE ITALIA, 14",,impianti di stoccaggio o adduzione carburanti,10.55008585,45.58709788,POINT (10.55008585 45.58709788),alta
MILANO,MILANO,MI146.0717,Area EX ITALVER,VIE PARABIAGO 19/BUSTO ARSIZIO 36 19,(*),aree industriali dismesse,9.10939736,45.50102649,POINT (9.10939736 45.50102649),alta
VARESE,ALBIZZATE,VA002.0003,LAMBERTI SPA,"VIA PIAVE, 18",,aree industriali in attività,8.80638206,45.72744471,POINT (8.80638206 45.72744471),alta
BERGAMO,BERGAMO,BG024.0052,ITIB,VIA CRISTOFORO BAIONI,,impianti di stoccaggio o adduzione carburanti,9.67745725,45.70609664,POINT (9.67745725 45.70609664),alta
MILANO,TREZZO SULL ADDA,MI221.0003,DITTA FORNACE LATERIZI,VIA FRANCESCO GUARNERIO,,smaltimenti non autorizzati - abbandono rifiuti,9.51467495,45.60951752,POINT (9.51467495 45.60951752),alta
BERGAMO,TREVIGLIO,BG219.0002,EX STABILIMENTO BASLINI S.P.A. ORA HABITA SRL,"PIAZZALE ERNESTO BASLINI, 1",,aree industriali in attività,9.58461189,45.51636049,POINT (9.58461189 45.51636049),alta
COMO,COMO,CO075.0102,EX STAMPERIA DI CAMERIATA,"VIA MARCO CUMANO, 16",,aree industriali dismesse,9.08785739,45.78581696,POINT (9.08785739 45.78581696),alta
MILANO,CORBETTA,MI085.0006,RITROVAMENTO RIFIUTI INTERRATI,CASCINA MALPAGA,,smaltimenti non autorizzati - abbandono rifiuti,8.90991446,45.46867438,POINT (8.90991446 45.46867438),alta
MANTOVA,SAN GIACOMO DELLE SEGNATE,MN056.0003,C.A.L.V. CONSORZIO AGRARIO LOMBARDO VENETO - DISMISSIONE DEPOSITO OLI MINERALI,"VIA UGO RONCADA, 3",,altri siti non meglio specificati,11.03454254,44.97069841,POINT (11.03454254 44.97069841),alta
MILANO,MILANO,MI146.0407,KUWAIT P.V. 1941,"VIA DEL MARE, 30",,impianti di stoccaggio o adduzione carburanti,9.15860528,45.42210363,POINT (9.15860528 45.42210363),alta
MILANO,MILANO,MI146.4290,MARMIFICIO CERTOSA EX,"VIALE CERTOSA, 135",,aree industriali dismesse,9.1390034,45.49558068,POINT (9.1390034 45.49558068),alta
MILANO,MILANO,MI146.0187,"PV 49096, SHELL ITALIA SPA","VIALE MARCHE, 62",(*),impianti di stoccaggio o adduzione carburanti,9.19159571,45.49646276,POINT (9.19159571 45.49646276),alta
MILANO,MILANO,MI146.2703,Scuola comunale - serbatoio interrato,"VIA VITTORIA COLONNA, 42",(*),serbatoi carburante per riscaldamento,9.15006606,45.46819688,POINT (9.15006606 45.46819688),alta
BRESCIA,ORZINUOVI,BS125.0004,PV ESSO 1324,"VIALE ADUA, 26",,impianti di stoccaggio o adduzione carburanti,9.93238549,45.40898434,POINT (9.93238549 45.40898434),alta
MILANO,MILANO,MI146.3044,AREA VIA ROVELLO,"VIA ROVELLO, 14",,altri siti non meglio specificati,9.18391212,45.46794032,POINT (9.18391212 45.46794032),alta
BERGAMO,CIVIDATE AL PIANO,BG076.0002,OLIFER ACP Acciaierie di Cividate,"CASCINA MOTTA ALTA, 14",,aree industriali in attività,9.8290044,45.52550657,POINT (9.8290044 45.52550657),bassa
VARESE,CARNAGO,VA033.0005,Sversamento gasolio uso civile,"VIA PROFESSORE GIOVANNI CASTIGLIONI, 6",,serbatoi carburante per riscaldamento,8.83601568,45.72181957,POINT (8.83601568 45.72181957),alta
SONDRIO,SONDRIO,SO061.0002,EX COTONIFICIO FOSSATI,"VIA FELICE FOSSATI, 1",,aree industriali dismesse,9.87200266,46.17504744,POINT (9.87200266 46.17504744),alta
PAVIA,VALEGGIO,PV167.0001,"SVERSAMENTO KEROSENE, OLEODOTTO ENI",LOCALITA' CASCINA CARDINALA,(*),rilasci accidentali o dolosi di sostanze,8.8727795,45.14913257,POINT (8.8727795 45.14913257),bassa
LODI,CRESPIATICA,LO025.0003,EX SAINT GOBAIN ISOVER ITALIA ORA DITTA OTIL,"VIA DANTE ALIGHIERI, 76",,aree industriali dismesse,9.5781108,45.34760418,POINT (9.5781108 45.34760418),alta
MILANO,MILANO,MI146.1096,Area condominiale - Serbatoi centrale termica,VIA DELLA MARNA,,altri siti non meglio specificati,9.17256654,45.52449563,POINT (9.17256654 45.52449563),alta
LECCO,LECCO,LC042.0049,area ex discarica,VIALE DON GIOVANNI TICOZZI,,altri siti non meglio specificati,9.40776089,45.83432409,POINT (9.40776089 45.83432409),alta
MILANO,OPERA,MI159.0003,AREA EX PROTER - Proprietà RECORDATI S.P.A. - NUOVA VALLAMBROSIA - ora FARMAOPERA SPA,VIA LAMBRO,,aree industriali dismesse,9.20837989,45.36995925,POINT (9.20837989 45.36995925),alta
MILANO,MILANO,MI146.0493,"AREA I.T.I.S. ""GIORGI""","VIALE LIGURIA, 21",,altri siti non meglio specificati,9.17066979,45.44402544,POINT (9.17066979 45.44402544),alta
BRESCIA,BRESCIA,BS029.0196,SISA - PV TANGENZIALE OVEST,TANGENZIALE OVEST,,altri siti non meglio specificati,10.16804469,45.51143115,POINT (10.16804469 45.51143115),alta
MILANO,CARPIANO,MI050.0007,Stazione di Servizio SODIN SRL,S.S.PROVINCIALE BINASCO-MELEGNANO,(*),aree industriali in attività,9.2733005,45.34550468,POINT (9.2733005 45.34550468),bassa
MILANO,MILANO,MI146.4257,AREA DI VIA COLLEONI,"VIA BARTOLOMEO COLLEONI, 14",,altri siti non meglio specificati,9.15298975,45.48227174,POINT (9.15298975 45.48227174),alta
VARESE,SARONNO,VA119.0054,VIA MANTEGAZZA,"VIA PAOLO MANTEGAZZA, 9",,aree industriali dismesse,9.02166598,45.62542433,POINT (9.02166598 45.62542433),alta
MILANO,MILANO,MI146.4184,REALIZZAZIONE DI NUOVO VOLUME OSPEDALIERO - P.O. BUZZI - INDAGINI PRELIMINARI,"VIA LODOVICO CASTELVETRO, 22",,altri siti non meglio specificati,9.16494566,45.48513226,POINT (9.16494566 45.48513226),alta
BERGAMO,ZANDOBBIO,BG244.0001,M.B.A. SRL,LOC.VALLE DEL SEI,,attività minerarie o estrattive,9.8626683,45.68538127,POINT (9.8626683 45.68538127),alta
