PROVINCIA,COMUNE,ID_AGISCO,DENOMINAZIONE,INDIRIZZO,NOTE,TIPOLOGIA SITO/ATTIVITA',LONGITUDINE,LATITUDINE,LOCATION,PRECISIONE_LOCATION
MILANO,MILANO,MI146.4326,AREA VIA BISTOLFI,"VIA LEONARDO BISTOLFI, 7",,altri siti non meglio specificati,9.24533454,45.47282241,POINT (9.24533454 45.47282241),alta
PAVIA,PARONA,PV109.0016,SVERSAMENTO IDROCARBURI DA EFFRAZIONE OLEODOTTO SARPOM DEL 25/04/2016,VIA CASE SPARSE PER ALBONESE,,rilasci accidentali o dolosi di sostanze,8.72467557,45.28580519,POINT (8.72467557 45.28580519),alta
MILANO,MILANO,MI146.4271,AREA VIA LEPONTINA,"VIA LEPONTINA, 7",,aree industriali dismesse,9.18343725,45.49344658,POINT (9.18343725 45.49344658),alta
VARESE,GAVIRATE,VA072.0001,AREA EX P.V. IP N. 6474 LOC. VOLTORRE,S.P.N.36 36,,impianti di stoccaggio o adduzione carburanti,8.72494165,45.84389392,POINT (8.72494165 45.84389392),bassa
COMO,COMO,CO075.0115,PIANO DI INDAGINE AMBIENTALE RIMOZIONE SERBATOI INTERRATI EX P.V. TOTAL ERG,"VIA GIOVANNI BATTISTA SCALABRINI, 82",,impianti di stoccaggio o adduzione carburanti,9.07301526,45.77749949,POINT (9.07301526 45.77749949),alta
MILANO,MELEGNANO,MI140.0028,TAMINI TRASFORMATORI S.R.L.,"VIA EMILIA, 37",,aree industriali in attività,9.32330642,45.36382863,POINT (9.32330642 45.36382863),alta
MILANO,SEGRATE,MI205.0011,AREA LUCCHINI ARTONI SRL,"VIA GIAMBATTISTA TIEPOLO, 16",(*),aree industriali in attività,9.3006159,45.48639455,POINT (9.3006159 45.48639455),alta
COMO,VERCANA,CO239.0001,Terreno agricolo proprietà privata,LOCALITA' CAVAGNANA,,rilasci accidentali o dolosi di sostanze,9.3396761,46.1716303,POINT (9.3396761 46.1716303),bassa
MILANO,GARBAGNATE MILANESE,MI105.0001,EX MASIDEF SPA,"VIALE CARLO FORLANINI, 92",(*),aree industriali in attività,9.08950204,45.58114869,POINT (9.08950204 45.58114869),alta
MILANO,TURBIGO,MI226.0015,CAVA ARBUSTA,"VIA XXV APRILE 1945, 10",,attività minerarie o estrattive,8.74124725,45.53092239,POINT (8.74124725 45.53092239),alta
BERGAMO,BERGAMO,BG024.0141,DISMISSIONE SERBATOIO,VIA GASPARINO DA BARZIZZA,,serbatoi carburante per riscaldamento,9.69026221,45.70838807,POINT (9.69026221 45.70838807),alta
BERGAMO,COLZATE,BG080.0001,HUNI ITALIANA S.P.A.,"VIA GUGLIELMO MARCONI, 12",,aree industriali in attività,9.85696976,45.81653548,POINT (9.85696976 45.81653548),alta
PAVIA,TROMELLO,PV164.0008,SVERSAMENTO ENEL,LOCALITA' BALZE',,rilasci accidentali o dolosi di sostanze,8.85040359,45.20425168,POINT (8.85040359 45.20425168),bassa
MONZA E DELLA BRIANZA,MONZA,MI149.0004,F.LLI RE S.A.S.,"VIA TORQUATO TASSO, 11",,aree industriali dismesse,9.28868077,45.58197144,POINT (9.28868077 45.58197144),alta
MANTOVA,BORGO MANTOVANO,MN067.0004,FOSSO GALENE IN FREGIO ALLA DITTA LA VETRI,FOSSO GALENE,,altri siti non meglio specificati,,,,nd
MILANO,VIMODRONE,MI242.0010,Cà Azzurra,"VIA ACHILLE GRANDI, 32",(*),,9.29588674,45.51163547,POINT (9.29588674 45.51163547),alta
VARESE,CARNAGO,VA033.0002,EX RESINE SINTETICHE ADAMOLI -EX ADAM,"VIA MONTE GRAPPA, 58",,aree industriali dismesse,8.83350941,45.72838286,POINT (8.83350941 45.72838286),alta
PAVIA,PAVIA,PV110.0060,EX SIAD SOCIETÀ ITALIANA ACETILENE E DERIVATI S.P.A.,"VIALE GIUSEPPE MARIA GIULIETTI, 425",,aree industriali dismesse,9.14616386,45.17446786,POINT (9.14616386 45.17446786),alta
MILANO,MILANO,MI146.4316,"A2A SERVIZI, CENTRALE FAMAGOSTA","VIA ROSA BIANCA, 2",,aree industriali in attività,9.15933654,45.46819153,POINT (9.15933654 45.46819153),bassa
MILANO,SESTO SAN GIOVANNI,MI209.0112,Area ECIS,VIA MILANO,(*),,9.24288953,45.52646734,POINT (9.24288953 45.52646734),alta
MILANO,MILANO,MI146.4318,AREA UNIVERSITARIA,"VIA EDOARDO BASSINI, 16",,altri siti non meglio specificati,9.23366105,45.48004264,POINT (9.23366105 45.48004264),alta
MANTOVA,CASTIGLIONE DELLE STIVIERE,MN017.0001,HUNTSMAN (EX ALBRIGHT & WILSON),"VIA CONTE CAMILLO BENSO DI CAVOUR, 50",,aree industriali in attività,10.47993537,45.39003444,POINT (10.47993537 45.39003444),alta
BERGAMO,PONTE NOSSA,BG168.0002,"Enirisorse ex Ditta Nuova Samin, Ponte Nossa S.p.A.",LOCALITA' PONTE RISO,(*),discariche abusive o incontrollate,9.8858494,45.861607,POINT (9.8858494 45.861607),bassa
BRESCIA,GARDONE VALTROMPIA,BS075.0001,TRW ITALIA S.P.A.,"VIA VALTROMPIA, 125",,aree industriali in attività,10.19970461,45.69954963,POINT (10.19970461 45.69954963),alta
MANTOVA,ASOLA,MN002.0004,ex Ditta Ghisleri e Domaschio,VIA LUIGI PIRANDELLO,,altri siti non meglio specificati,10.40440097,45.22383417,POINT (10.40440097 45.22383417),alta
CREMONA,CREMONA,CR036.0072,KEROPETROL SpA,"VIA BOSCHETTO, 12",,impianti di stoccaggio o adduzione carburanti,10.02297989,45.15137397,POINT (10.02297989 45.15137397),alta
MILANO,MILANO,MI146.4220,AREA DI VIA SERLIO 7,"STRADA PRIVATA SEBASTIANO SERLIO, 7",,aree industriali dismesse,9.22167146,45.44209309,POINT (9.22167146 45.44209309),alta
LODI,LODI,LO031.0048,AREA EX CONSORZIO AGRARIO,"VIA GIOVANNI GANDINI, 3",,aree industriali dismesse,9.49447555,45.31106214,POINT (9.49447555 45.31106214),alta
BERGAMO,BOLTIERE,BG029.0002,ex Cava Francesca,LOCALITA' FOPPA DEL FIRMI',(*),discariche abusive o incontrollate,9.58308778,45.60357131,POINT (9.58308778 45.60357131),alta
MILANO,LEGNANO,MI118.0087,Sito di via Genova,"VIA GENOVA, 34/36",(*),,8.90382943,45.59380315,POINT (8.90382943 45.59380315),alta
MILANO,PERO,MI170.0002,CARBOTERMO SPA,"VIA FILIPPO TURATI, 25",,impianti di stoccaggio o adduzione carburanti,9.09279288,45.51124489,POINT (9.09279288 45.51124489),alta
BERGAMO,TRESCORE BALNEARIO,BG218.0003,AREA VALFERRO SNC,"VIA ANTONIO GRAMSCI, 35",,aree industriali in attività,9.83843837,45.68516963,POINT (9.83843837 45.68516963),alta
MILANO,CORNAREDO,MI087.0027,EFFRAZIONE OLEODOTTO ENI,S.P.214,,rilasci accidentali o dolosi di sostanze,9.02468384,45.48787748,POINT (9.02468384 45.48787748),bassa
BERGAMO,BERGAMO,BG024.0067,"ROTAFRIGO, CONTAMINAZIONE FALDA",LOCALITA' LONGUELO-,,aree industriali in attività,9.63565722,45.69600347,POINT (9.63565722 45.69600347),alta
MILANO,MILANO,MI146.0388,CROMATURA ANGELINI EX AREA INDUSTRIALE,"VIA MECENATE, 76",,aree industriali dismesse,9.2463881,45.45185935,POINT (9.2463881 45.45185935),alta
VARESE,SOMMA LOMBARDO,VA123.0023,AREA A SW DISCARICA DI VERGIATE,STRADA PROVINCIALE 47,,discariche autorizzate,8.69927384,45.70427594,POINT (8.69927384 45.70427594),alta
MILANO,COLOGNO MONZESE,MI081.0120,AREA VIA POLONIA,VIA POLONIA,,aree industriali dismesse,9.27055124,45.544389,POINT (9.27055124 45.544389),alta
BERGAMO,MAPELLO,BG132.0004,Ex deposito petrolifero SADOM,"VIA DEGLI ALPINI, 1",,aree industriali dismesse,9.56126221,45.71320633,POINT (9.56126221 45.71320633),alta
MILANO,MILANO,MI146.4296,AREA DISMESSA VIA CRESPI,"VIA DANIELE CRESPI, 16",,aree industriali dismesse,9.17310089,45.45655892,POINT (9.17310089 45.45655892),alta
MANTOVA,POGGIO RUSCO,MN042.0006,SVERSAMENTO ACCIDENTALE CARBURANTE C/O BANCHINA STRADALE,"VIA ABETONE BRENNERO, 20-22B/C",,rilasci accidentali o dolosi di sostanze,11.12071665,44.98222593,POINT (11.12071665 44.98222593),alta
MILANO,MILANO,MI146.2408,NUOVO DEPOSITO AUTOBUS ATM,VIA IMPASTATO (GIA' VIA MARIGNANO),(*),,9.25611823,45.42800639,POINT (9.25611823 45.42800639),alta
MONZA E DELLA BRIANZA,SEVESO,MB040.0003,PEDEMONTANA TRATTA B2 - AREE INFLUENZATE DA INCIDENTE ICMESA,,,altri siti non meglio specificati,9.1424819,45.6464554,POINT (9.1424819 45.6464554),bassa
BRESCIA,PADERNO FRANCIACORTA,BS130.0002,EX CAVA VIANELLI,VIA A.DE GASPERI-LOC.SANTELLA 35,,discariche abusive o incontrollate,10.07580982,45.58633296,POINT (10.07580982 45.58633296),alta
MILANO,SETTALA,MI210.0013,SETTALLA STOCAGGIO- CENTRALE STOCCAGGIO GAS,LOCALITA' CASCINA BAIALUPA,,aree industriali in attività,9.39729633,45.45396027,POINT (9.39729633 45.45396027),alta
MILANO,MILANO,MI146.3058,AREA VIA PECORI GIRALDI,"VIA GUGLIELMO PECORI GIRALDI, 5",,aree industriali dismesse,9.23246714,45.44093674,POINT (9.23246714 45.44093674),alta
BERGAMO,GANDINO,BG108.0002,TAMOIL - P.V. N.1035 - DISMISSIONE DEFINITIVA,"VIA CESARE BATTISTI, 24",,impianti di stoccaggio o adduzione carburanti,9.92882604,45.82379707,POINT (9.92882604 45.82379707),bassa
MILANO,MILANO,MI146.1130,Area di Largo Giambellino,"LARGO GIAMBELLINO, 129",,altri siti non meglio specificati,9.13428345,45.44717293,POINT (9.13428345 45.44717293),alta
MILANO,BARANZATE,MI250.0035,"COSTRUZIONI AGRICOLE E INDUSTRIALI Srl, ex WEISS","VIA CRISTINA BELGIOIOSO, 13/15",,aree industriali in attività,9.10422873,45.52275969,POINT (9.10422873 45.52275969),alta
LECCO,OLGIATE MOLGORA,LC058.0004,SVERSAMENTO GASOLIO DA CISTERNA INTERRATA,"VIA MONDONICO, 13",(*),rilasci accidentali o dolosi di sostanze,9.39866288,45.73753021,POINT (9.39866288 45.73753021),alta
VARESE,MALNATE,VA096.0001,AREA EX SIOME - FOLLA DI MALNATE,VIA GORIZIA,,aree industriali dismesse,8.87069192,45.80094961,POINT (8.87069192 45.80094961),alta
PAVIA,BRONI,PV024.0001,P.V. TAMOIL 4207,PIAZZA VITTORIO VENETO,,impianti di stoccaggio o adduzione carburanti,9.26030917,45.0627426,POINT (9.26030917 45.0627426),alta
COMO,GERA LARIO,CO107.0004,Area proprietà privata,S.P.340DIR,,discariche abusive o incontrollate,9.3867708,46.15342681,POINT (9.3867708 46.15342681),bassa
MILANO,SESTO SAN GIOVANNI,MI209.0082,IMMOBILIARE VIALE ITALIA SRL Area BC41,"VIALE ITALIA, 936",,aree industriali dismesse,9.2582497,45.55047585,POINT (9.2582497 45.55047585),alta
VARESE,VENEGONO SUPERIORE,VA137.0005,POZZO AREA DITTA ALENIA AERMACCHI SPA,VIA FORESIO 1,,aree industriali in attività,8.90143345,45.75472205,POINT (8.90143345 45.75472205),bassa
MILANO,BUCCINASCO,MI036.0004,GALVANICA GENTILE S.r.l.,"VIA PIEMONTE, 38",,aree industriali in attività,9.12136317,45.41610335,POINT (9.12136317 45.41610335),alta
MILANO,MILANO,MI146.4192,BORLETTI EX,VIA CECCHI 18,,aree industriali dismesse,9.15211869,45.46057836,POINT (9.15211869 45.46057836),alta
BERGAMO,VERDELLINO,BG232.0007,IMM.RE LA RODIOLA - AREA EURODOLCIARIA S.R.L.,"VIALE BERLINO, 1",,aree industriali in attività,9.60662436,45.59533168,POINT (9.60662436 45.59533168),alta
BRESCIA,VILLA CARCINA,BS199.0004,EFFEBIESSE S.p.A. - CONTAMINAZIONE FALDA DA CROMO ESAVALENTE,"VIA VENETO, 142",,aree industriali in attività,10.19519074,45.62902399,POINT (10.19519074 45.62902399),alta
MILANO,RHO,MI182.0019,ROTTURA OLEODOTTO LUCERNATE,FRAZIONE LUCERNATE,(*),rilasci accidentali o dolosi di sostanze,9.05141614,45.53067483,POINT (9.05141614 45.53067483),bassa
MONZA E DELLA BRIANZA,LESMO,MI120.0002,PV SHELL 49.022,"VIA XXV APRILE, 18",,impianti di stoccaggio o adduzione carburanti,9.30869667,45.65234672,POINT (9.30869667 45.65234672),alta
MILANO,MILANO,MI146.1031,P.V. ESSO 0428,"VIALE LIGURIA, 52",(*),impianti di stoccaggio o adduzione carburanti,9.17579459,45.4435668,POINT (9.17579459 45.4435668),alta
COMO,MOZZATE,CO159.0005,ECONORD- DISCARICA GORLA-MOZZATE -CAVA SATIMA,SP 37 LOCALITA' EX CAVA SATIMA,,discariche autorizzate,8.94927475,45.6714305,POINT (8.94927475 45.6714305),bassa
VARESE,GALLARATE,VA070.0007,TI.FI.TEX. S.R.L.,"VIA ADIGE, 12",,aree industriali in attività,8.81469716,45.64536014,POINT (8.81469716 45.64536014),alta
MILANO,LAINATE,MI116.0008,"P.V. AGIP 51905, A8 ""Villoresi Ovest""",AUTOSTRADA A8,,impianti di stoccaggio o adduzione carburanti,9.02565695,45.56596031,POINT (9.02565695 45.56596031),bassa
COMO,COMO,CO075.0055,TICOSA - EX AREA INDUSTRIALE,VIA GRANDI/ROOSVELT,,aree industriali dismesse,9.0858007,45.79971599,POINT (9.0858007 45.79971599),alta
PAVIA,PINAROLO PO,PV115.0001,EX CHIMICA PONTE ALTO,LOCALITA' CA' DE' GIORGI,,aree industriali dismesse,9.18766751,45.09532087,POINT (9.18766751 45.09532087),alta
BRESCIA,DESENZANO DEL GARDA,BS067.0002,FEDERAL MOGUL,"VIALE GUGLIELMO MARCONI, 131",,aree industriali dismesse,10.52745502,45.46708352,POINT (10.52745502 45.46708352),alta
MILANO,SAN GIULIANO MILANESE,MI195.0001,"Sito Air Product, proprietà Ashaland Italia spa","VIA UMBRIA, 4",,aree industriali in attività,9.24960127,45.39854631,POINT (9.24960127 45.39854631),alta
LECCO,CALOLZIOCORTE,LC013.0023,ZINCOFUOCO,"VIA LAGO VECCHIO, 22",,aree industriali dismesse,9.43882057,45.77926313,POINT (9.43882057 45.77926313),alta
LODI,VALERA FRATTA,LO059.0001,EX DISCARICA VALERA FRATTA,,,discariche autorizzate,9.3347303,45.25794108,POINT (9.3347303 45.25794108),bassa
MONZA E DELLA BRIANZA,RONCELLO,MB055.0001,L'ISOLANTE K-FLEX S.P.A.,"VIA LEONARDO DA VINCI, 36",,aree industriali in attività,9.46702191,45.60129224,POINT (9.46702191 45.60129224),alta
MILANO,MEDIGLIA,MI139.0002,AREA S.P. 39 - MEDIGLIA SERVIZI ECOLOGICI (BIOTECH),S.S.PAULLESE (LOC.CERCA-MEDIGLIA),,operazioni di recupero rifiuti,9.34159255,45.41167773,POINT (9.34159255 45.41167773),bassa
BERGAMO,URGNANO,BG222.0006,PIANO ATTUATIVO RESIDENZIALE ATRE2,VIA DON FADINI,,altri siti non meglio specificati,9.72069627,45.61891583,POINT (9.72069627 45.61891583),alta
MILANO,VANZAGO,MI229.0003,EX CAVA VALDARENNE,CASCINA VALDARENNE,,discariche abusive o incontrollate,8.98541555,45.51930662,POINT (8.98541555 45.51930662),bassa
MILANO,CINISELLO BALSAMO,MI077.0045,"SCUOLA MATERNA ""IL GIRASOLE"", serbatoio interrato","VIALE ABRUZZI, 21",(*),altri siti non meglio specificati,9.23193045,45.54874257,POINT (9.23193045 45.54874257),alta
LECCO,LECCO,LC042.0046,P.V. FREMAR,VIA VALSUGANA ANGOLO CORSO ALBERTO,,impianti di stoccaggio o adduzione carburanti,9.41074455,45.83989179,POINT (9.41074455 45.83989179),alta
MILANO,CANEGRATE,MI046.0008,"ITS, FIOR-GIEFFE",VIA RAVENNA,(*),aree industriali dismesse,8.91032283,45.56303938,POINT (8.91032283 45.56303938),alta
MILANO,MILANO,MI146.0529,PUNTO VENDITA AGIP 54367,"VIA GALLARATE, 391",,impianti di stoccaggio o adduzione carburanti,9.10891537,45.50409169,POINT (9.10891537 45.50409169),alta
BERGAMO,TREVIGLIO,BG219.0024,AREE ESTERNE BASLINI - AREA E PROPRIETÀ TONINI,VIA DI MEZZO,(*),altri siti non meglio specificati,9.58520442,45.51833767,POINT (9.58520442 45.51833767),alta
MILANO,MILANO,MI146.4285,Area proprietà privata,"VIA RAIMONDO MONTECUCCOLI, 15",,altri siti non meglio specificati,9.13185509,45.45874562,POINT (9.13185509 45.45874562),alta
BERGAMO,BAGNATICA,BG018.0004,FRATELLI NICOLI - DISMISSIONE SERBATOIO,VIA SAN PIETRO,,serbatoi carburante per riscaldamento,9.78537876,45.66048234,POINT (9.78537876 45.66048234),alta
LODI,CASTELGERUNDO,LO016.0002,"OLEODOTTO ENI 26 "" BERTONICO-CREMONA IN COMUNE DI CAVACURTA",FG.2 MAPPALE 4,,rilasci accidentali o dolosi di sostanze,,,,nd
MILANO,VANZAGO,MI229.0007,EFFRAZIONE OLEODOTTO ENI RHO-MALPENSA VANZAGO,CASCINA,,rilasci accidentali o dolosi di sostanze,8.98541555,45.51930662,POINT (8.98541555 45.51930662),bassa
MANTOVA,SUZZARA,MN065.0007,DISMISSIONE IMPIANTO PV TAMOIL N.8042,"VIA FRATELLI MONTECCHI, 4/A",,impianti di stoccaggio o adduzione carburanti,10.74385475,44.9901313,POINT (10.74385475 44.9901313),alta
MILANO,MILANO,MI146.3381,AREA VIA E.T. MONETA,VIA MONETA,,aree industriali dismesse,9.18501726,45.46387446,POINT (9.18501726 45.46387446),alta
VARESE,CARONNO PERTUSELLA,VA034.0031,DIPHARMA FRANCIS S.R.L.,"VIA ORIGGIO, 23",(*),aree industriali in attività,9.03447909,45.5958025,POINT (9.03447909 45.5958025),alta
BERGAMO,CISERANO,BG075.0003,EX CASTELCROM ORA MAIER CROMOPLASTICA,"VIA MARTIN LUTHER KING, 5",,aree industriali in attività,9.59265733,45.58436709,POINT (9.59265733 45.58436709),alta
MILANO,PESCHIERA BORROMEO,MI171.0009,Stabilimento SIRPI S.p.a.,"VIA ACHILLE GRANDI, 8",,aree industriali in attività,9.28732809,45.44169799,POINT (9.28732809 45.44169799),alta
MILANO,MILANO,MI146.0233,AREA ex PIRELLI,"VIA ENRICO CAVIGLIA, 3",,aree industriali dismesse,9.22991228,45.44291117,POINT (9.22991228 45.44291117),alta
BRESCIA,BRESCIA,BS029.0166,PUNTO 5 S.R.L.,SCALO MERCI,,altri siti non meglio specificati,10.22054132,45.54017089,POINT (10.22054132 45.54017089),alta
MILANO,MILANO,MI146.3273,AREA DI VIA LORENTEGGIO 170,"VIA LORENTEGGIO, 170",(*),aree industriali dismesse,9.1331725,45.44894839,POINT (9.1331725 45.44894839),alta
MANTOVA,MANTOVA,MN030.0077,P.V. ERG,CORSO PORTA MULINA-,,impianti di stoccaggio o adduzione carburanti,10.81353615,45.15706081,POINT (10.81353615 45.15706081),bassa
LODI,SECUGNAGO,LO052.0001,Ex Società SCAR S.r.l.,LOCALITA' MULINO POLENZONE,,aree industriali dismesse,9.59645355,45.23156176,POINT (9.59645355 45.23156176),bassa
CREMONA,SERGNANO,CR094.0001,STOGIT SPA CENTRALE DI SERGNANO 2,"STRADA VALLARSA, 18",,attività minerarie o estrattive,9.69827341,45.42629883,POINT (9.69827341 45.42629883),alta
MILANO,MILANO,MI146.0326,EX PUNTO VENDITA API,"VIA BERNARDO RUCELLAI, 50",(*),impianti di stoccaggio o adduzione carburanti,9.21538021,45.51105106,POINT (9.21538021 45.51105106),alta
SONDRIO,VILLA DI TIRANO,SO078.0003,EMME CASE SRL 1,VIA BREBBIA,(*),altri siti non meglio specificati,10.13754441,46.20594289,POINT (10.13754441 46.20594289),alta
VARESE,CASTRONNO,VA047.0001,AREA DI SERVIZIO AUTOSTRADA A8 - BRUGHIERA OVEST - P.V. ESSO 0665,"AUTOSTRADA A8 MILANO LAGHI KM 42,900",,impianti di stoccaggio o adduzione carburanti,8.81086654,45.75217363,POINT (8.81086654 45.75217363),bassa
MILANO,MILANO,MI146.2289,Sito Galileo Avionica ora Finmeccanica Group Real Estate S.p.A.,"VIA GIOVANNI BATTISTA GRASSI, 93",,aree industriali dismesse,9.1184209,45.5189951,POINT (9.1184209 45.5189951),alta
PAVIA,CASTEGGIO,PV037.0001,P.V. AGIP 2554,PIAZZA VITTORIO VENETO,,impianti di stoccaggio o adduzione carburanti,9.12882549,45.015738,POINT (9.12882549 45.015738),alta
MILANO,CORMANO,MI086.0010,SU.PER SRL,"VIA ANTONIO GRAMSCI, 41",,aree industriali dismesse,9.16703267,45.53902218,POINT (9.16703267 45.53902218),alta
MILANO,MILANO,MI146.2942,AREA DI VIA RIZZARDI,"VIA FRATELLI RIZZARDI, 45",,aree industriali dismesse,9.10045323,45.49496451,POINT (9.10045323 45.49496451),alta
MILANO,OZZERO,MI165.0005,EFFRAZIONE OLEODOTTO SANNAZZARO,STRADA PROVINCIALE 183,,rilasci accidentali o dolosi di sostanze,8.9238774,45.36560765,POINT (8.9238774 45.36560765),alta
MONZA E DELLA BRIANZA,CESANO MADERNO,MI075.0005,Discariche ex SNIA - Aree esterne di proprietà NYLSTAR - Immobiliare SNIA,VIA GROANE,,discariche abusive o incontrollate,9.1173619,45.62942749,POINT (9.1173619 45.62942749),alta
MILANO,BOLLATE,MI027.0011,AREA EX SILPA,"VIA MILANO, 50",(*),aree industriali dismesse,9.10310475,45.53867293,POINT (9.10310475 45.53867293),alta
SONDRIO,NOVATE MEZZOLA,SO046.0002,"CAVA BUSAN, LARIO SCAVI SRL",LOCALITA' BUSAN,(*),attività minerarie o estrattive,9.5003856,46.19062757,POINT (9.5003856 46.19062757),bassa
MILANO,CASTANO PRIMO,MI062.0006,AREA DI VIA MARCONI 1,"VIA GUGLIELMO MARCONI, 1",(*),aree industriali dismesse,8.78220109,45.55536412,POINT (8.78220109 45.55536412),alta
MILANO,MILANO,MI146.4250,ANTICA RIPA SRL,"VIA MONTI SABINI, 11",,aree industriali dismesse,9.20137678,45.4297863,POINT (9.20137678 45.4297863),alta
MILANO,MILANO,MI146.4160,PLESSO SCOLASTICO SCROSATI,"VIA LUIGI SCROSATI, 3",,serbatoi carburante per riscaldamento,9.1405602,45.45406379,POINT (9.1405602 45.45406379),alta
PAVIA,FERRERA ERBOGNONE,PV062.0006,DEPOSITO PRAOIL OLEODOTTI ITALIANI S.P.A.,STRADA PROVINCIALE 28 PER PIEVE DEL CAIRO,(*),aree industriali in attività,8.85450175,45.08000726,POINT (8.85450175 45.08000726),bassa
BRESCIA,CAPRIANO DEL COLLE,BS037.0001,Discarica Raffineria Metalli Capra,LOCALITA' MONTE NETTO,,discariche autorizzate,10.12473608,45.45546409,POINT (10.12473608 45.45546409),alta
MILANO,MILANO,MI146.1875,P.V. ESSO 0172,"VIA GALLARATE, 392",(*),impianti di stoccaggio o adduzione carburanti,9.10573074,45.50485544,POINT (9.10573074 45.50485544),alta
MILANO,ABBIATEGRASSO,MI002.0013,P.V. ESSO 0425,VIA MAZZINI/ANGOLO VIA DANTE,,impianti di stoccaggio o adduzione carburanti,8.92616109,45.3948899,POINT (8.92616109 45.3948899),alta
MILANO,MILANO,MI146.4346,AREA CR71 PROJECT SRL,"VIA GIOVANNI BATTISTA PRANDINA, 4",,aree industriali dismesse,9.23727037,45.50633513,POINT (9.23727037 45.50633513),alta
BRESCIA,NAVE,BS117.0006,Area EX AFIM - ACCIARIA FENOTTI E COMINI,"VIA TRENTO, 26",,aree industriali dismesse,10.28950884,45.58610643,POINT (10.28950884 45.58610643),alta
MONZA E DELLA BRIANZA,VIMERCATE,MI241.0017,OSPEDALE NUOVO VIMERCATE,"VIA SANTI COSMA E DAMIANO, 10",(*),rilasci accidentali o dolosi di sostanze,9.3580982,45.6084494,POINT (9.3580982 45.6084494),alta
LECCO,BELLANO,LC008.0001,"Presidio Ospedaliero Umberto I, sversamento olio","VIA CARLO ALBERTO, 25",,rilasci accidentali o dolosi di sostanze,9.30687709,46.0479647,POINT (9.30687709 46.0479647),alta
MILANO,TREZZANO SUL NAVIGLIO,MI220.0024,SERBATOIO GASOLIO,VIA L.DA VINCI ANGOLO MARONCELLI,(*),serbatoi carburante per riscaldamento,9.06495766,45.42377091,POINT (9.06495766 45.42377091),alta
MILANO,MILANO,MI146.3929,"STABILE, DISMISSIONE SERBATOI","VIALE TOSCANA, 9",(*),serbatoi carburante per riscaldamento,9.19667642,45.44632346,POINT (9.19667642 45.44632346),alta
BRESCIA,BERZO DEMO,BS016.0006,SELCA SPA IN FALLIMENTO,LOCALITA' FORNO D' ALLIONE,,operazioni di recupero rifiuti,10.31878762,46.08838811,POINT (10.31878762 46.08838811),alta
MILANO,MILANO,MI146.2521,AREA EX PARABIAGHI spa,"VIA GIOVANNI BATTISTA FAUCHE', 13",,aree industriali dismesse,9.16467999,45.48528739,POINT (9.16467999 45.48528739),alta
PAVIA,VIGEVANO,PV177.0050,DEPOSITO FISCATECH,"VIA GENERALE RODOLFO MONTEVECCHIO, 35",,aree industriali dismesse,8.86648458,45.306311,POINT (8.86648458 45.306311),alta
MILANO,SESTO SAN GIOVANNI,MI209.0049,P.V. ESSO 0072,"VIALE RIMEMBRANZE, 191",,impianti di stoccaggio o adduzione carburanti,9.24093335,45.52466266,POINT (9.24093335 45.52466266),alta
MILANO,MILANO,MI146.3986,M4 EX CAVA TRE CASTELLI AREA STRALCIO,VIA GUIDO MARTINELLI,,altri siti non meglio specificati,9.13534415,45.44136294,POINT (9.13534415 45.44136294),alta
BERGAMO,SERIATE,BG198.0020,EX PV CARBURANTI,"VIA NAZIONALE, 33",,impianti di stoccaggio o adduzione carburanti,9.72914254,45.68518595,POINT (9.72914254 45.68518595),alta
LECCO,VERDERIO,LC087.0003,"TERNA SPA GRUPPO ENEL, CON CORNATE D'ADDA",LOCALITA' ROGGIA ANNONI-STAZIONE ELETTRICA,(*),rilasci accidentali o dolosi di sostanze,9.43545403,45.66264095,POINT (9.43545403 45.66264095),alta
LODI,FOMBIO,LO026.0009,AKZO NOBEL COATINGS - FOMBIO,"VIA EMILIA, 2",,aree industriali dismesse,9.67411171,45.14891494,POINT (9.67411171 45.14891494),alta
VARESE,DAVERIO,VA064.0002,P.V. TOTAL,"VIA CESARE BATTISTI, 75",,impianti di stoccaggio o adduzione carburanti,8.76956784,45.76560414,POINT (8.76956784 45.76560414),alta
MILANO,NOVATE MILANESE,MI157.0006,Area I.Pi.Ci,"VIA FRATELLI BELTRAMI, 11",,aree industriali in attività,9.13472392,45.52499655,POINT (9.13472392 45.52499655),alta
VARESE,LUINO,VA092.0005,Area di compostaggio,LOCALITA' CUCCO DI VOLDOMINO,,altri siti non meglio specificati,8.74484375,45.99980794,POINT (8.74484375 45.99980794),alta
MONZA E DELLA BRIANZA,MONZA,MB033.0045,EX TESSITURA,"VIA VAL D' OSSOLA, 17",,aree industriali dismesse,9.27117842,45.57067147,POINT (9.27117842 45.57067147),alta
VARESE,VARESE,VA133.0008,P.V. ESSO 673,"VIALE EUROPA, 82",,impianti di stoccaggio o adduzione carburanti,8.8322473,45.80490705,POINT (8.8322473 45.80490705),alta
MILANO,RHO,MI182.0093,EX ROTOINCISA,"VIA ENRICO MATTEI, 7",,aree industriali dismesse,9.02349243,45.53228791,POINT (9.02349243 45.53228791),alta
BRESCIA,SAREZZO,BS174.0012,OTTOMAN,"VIA MAESTRI DEL LAVORO, 1",,aree industriali in attività,10.2023739,45.6585188,POINT (10.2023739 45.6585188),bassa
CREMONA,CASTELLEONE,CR025.0001,EX STABILIMENTO BIC ITALIA,STRADA STATALE 415,(*),aree industriali dismesse,9.75080714,45.30593009,POINT (9.75080714 45.30593009),alta
BRESCIA,CONCESIO,BS061.0001,"CAFFARO SPA - SOTTOSTAZIONE ELETTRICA ""STOCCHETTA""","VIA GIUSEPPE ZANARDELLI, 50",,aree industriali dismesse,10.22492632,45.58875517,POINT (10.22492632 45.58875517),alta
MILANO,ARLUNO,MI010.0024,SOLLES SRL,VIA SANTO STEFANO TICINO,,attività minerarie o estrattive,8.94878735,45.51089836,POINT (8.94878735 45.51089836),bassa
MILANO,MILANO,MI146.1046,"AREA EX STAZIONE DI PORTA VITTORIA - SETTORE UCP5, UCP3 e BEIC",VIE CENA/UMBRIA/MONTE ORTIGARA/MOLISE,,altri siti non meglio specificati,9.2176166,45.45859438,POINT (9.2176166 45.45859438),alta
VARESE,SARONNO,VA119.0055,AREA VIA FRUA,"VIA GIUSEPPE FRUA, 19",,aree industriali dismesse,9.04112549,45.62979894,POINT (9.04112549 45.62979894),alta
VARESE,LONATE POZZOLO,VA090.0004,FONDERIA BOTTARINI EX AREA INDUSTRIALE,"VIA SILVIO PELLICO, 8",,aree industriali dismesse,8.75742769,45.59751056,POINT (8.75742769 45.59751056),alta
MILANO,SAN GIULIANO MILANESE,MI195.0060,AGIP PV 2516,AUTOSTRADA A50 TANGENZIALE OVEST DI MILANO,,impianti di stoccaggio o adduzione carburanti,9.2780372,45.3838531,POINT (9.2780372 45.3838531),bassa
MILANO,MILANO,MI146.4001,"PARCO BADEN PAWELL, GIÀ ""AREA ARGELATI-TORRE- LOMBARDINI""",VIE AUTARI E LOBARDINI,,aree industriali dismesse,9.1664468,45.44865373,POINT (9.1664468 45.44865373),alta
BRESCIA,MARONE,BS106.0001,"EX CASA DI RIPOSO, rimozione cisterna","VIA BATTISTA CRISTINI, 27",,serbatoi carburante per riscaldamento,10.09082746,45.73432479,POINT (10.09082746 45.73432479),alta
MILANO,CUSANO MILANINO,MI098.0005,IMMOBILIARE C.B. - AREA EX METALLVAKUUM POLIPLASTIC SPA,"VIA ABELE MERLI, 10",(*),aree industriali dismesse,9.1848095,45.54598998,POINT (9.1848095 45.54598998),alta
MONZA E DELLA BRIANZA,MONZA,MB033.0039,EX FELTRIFICIO,"VIALE CESARE BATTISTI, 40",,aree industriali dismesse,9.26598991,45.59234508,POINT (9.26598991 45.59234508),alta
PAVIA,PAVIA,PV110.0062,ex P.V. Agip n. 2569,"VIALE CREMONA, 64/73",,impianti di stoccaggio o adduzione carburanti,9.18785414,45.17970464,POINT (9.18785414 45.17970464),alta
MILANO,PADERNO DUGNANO,MI166.0088,AREA VIA PEPE,"VIA GUGLIELMO PEPE, 56",,aree industriali dismesse,9.15316251,45.56340091,POINT (9.15316251 45.56340091),alta
MILANO,SENAGO,MI206.0004,AREA EX PLASTECO MILANO S.r.l. - zona b (proprietà Londra s.r.l.),VIA VINCENZO MONTI,,aree industriali dismesse,9.12158616,45.57350674,POINT (9.12158616 45.57350674),alta
MANTOVA,ACQUANEGRA SUL CHIESE,MN001.0001,EX AMBROSIANA ITALFER,VIA MORO-LOC.MOSIO,,aree industriali dismesse,10.48510915,45.14867774,POINT (10.48510915 45.14867774),alta
